{"title":"Cómo Hacer Tu Guía","markdown":{"yaml":{"title":"Cómo Hacer Tu Guía","subtitle":"Saber Cómo Generar Informes Interactivos","date":"6 June 2024","author":[{"name":"Marion Iseppi, Consultora Senior","degree":"PhD","orcid":"0000-0002-7018-9270","email":"miseppi@srk.cl","corresponding":true,"affiliation":[{"name":"SRK Consulting Chile SpA","url":"https://www.srk.com/es/contactenos/chile"}]}],"format":{"html":{"css":"styles/srk.css","echo":false,"embed-resources":false}},"jupyter":"python3","toc":true,"toc-title":"Tabla de contenido","number-sections":true,"title-block-banner":true},"headingText":"Introducción","containsRefs":false,"markdown":"\n\n\nLos informes HTML son cada vez más populares ya que permiten una apariencia profesional rápida, incluir gráficos y mapas interactivos. \nDashboard Power BI se usa comúnmente dentro de SRK ([Conceptos básicos del Dashboard](https://learn.microsoft.com/en-us/power-bi/create-reports/service-dashboards)), es muy útil especialmente para monitorear proyectos.\n\nPero los informes HTML tienen varias ventajas:\n\n- accesibles desde cualquier máquina (computadora, tabletas, teléfono)\n- actualízalo sobre la marcha, así te aseguras de que el cliente siempre esté usando la última versión\n- puedes incluir fácilmente una opción para descargar tu informe como un documento pdf, word o powerpoint ya que los clientes suelen usar nuestras figuras para sus propios informes internos\n\n# Configura tu entorno\n\n## Instalar Quarto\n\n**Quarto** es un sistema de publicación científica y técnica de código abierto diseñado para crear documentos, informes, presentaciones y sitios web de alta calidad. Se integra perfectamente con herramientas y lenguajes como R, Python y Jupyter, lo que permite a los autores combinar texto, código y visualizaciones en un solo documento.\n\n1. Instala Quarto en tu máquina. Ve a [aquí](https://quarto.org/docs/get-started/). Tendrás que reiniciar tu máquina.\n\n::: {.callout-note}\nDocumentación extensa está disponible [en línea](https://quarto.org/docs/guide/). \n:::\n\n## Instalar extensiones\n\nPara usar **Quarto** con VS Code, necesitaremos instalar la extensión.\n\n1. Ve a la barra lateral en VS Code y selecciona ``Extensiones`` o `CTRL+X`.\n2. Busca Quarto e instala la extensión. \n\n![](media/Picture1.png)\n\n# Configura tu sitio web\n\n## Configura tu página principal\n\n1. Ve a la ventana **Explorer**, haz clic derecho y selecciona `New Folder`\n\n![](media/Picture2.png)\n\n2. El nombre de tu carpeta será el nombre de tu repositorio en GitHub (ver [Curso StartCodingToday](https://miseppi23.github.io/StartCodingToday)). En este caso, lo nombraré **HowToMakeYourGuide**.\n\n3. Para comenzar a crear tu página web, crea un nuevo archivo **.qmd**. Haz clic derecho en tu carpeta recién creada y selecciona `New file`. Aquí lo llamaré **HowToMakeYourGuide_Span.qmd**.\n\n![](media/Picture3.png)\n\n4. Luego necesitaremos crear e inicializar un archivo .yml que contendrá la información del sitio web: el título, los paneles de la barra de navegación y las páginas web (.qmd) que configuraremos a continuación. Crea un nuevo archivo y nómbralo **_quarto.yml**\n\n![](media/Picture4.png)\n\n5. Escribe lo siguiente en el archivo **_quarto.yml**\n\n```{.python}\nproject:\n  type: website\n  output-dir: docs\n\nwebsite:\n  title: \"Cómo Hacer Tu Guía\"\n  navbar:\n    left:\n      - href: HowToMakeYourGuide_Span.qmd\n        text: Span\n\nformat:\n  html:\n    theme: cosmo\n    toc: true\n```\n::: {.callout-important}\nLas líneas **output-dir: docs** significan que los archivos que Quarto generará para nuestro sitio web se guardarán en una carpeta llamada **docs**. \nAsegúrate de que esta línea esté presente en tu archivo .yml ya que será clave para publicar tu sitio en GitHub Pages.\n:::\n\n5. Abre tu archivo .qmd **HowToMakeYourGuide_Span.qmd**. Y usa el atajo de teclado ``CTRL+SHIFT+K``. Este atajo debería haberse instalado junto con la extensión de Quarto y se abrirá una ventana lateral con una vista previa de tu sitio web. Esto facilitará la construcción.\n\n![](media/Picture5a.png)\n\n:::::: {.callout-note}\nEl archivo **.yml** se puede actualizar en cualquier momento. Si deseas agregar una página, cambiar tu título, formato, etc. Lo gestionaremos a lo largo de la creación del sitio web.\n:::\n\n## Agregar otra página\n\nSi deseas crear otra página que estará disponible en la barra de navegación en la parte superior de tu sitio web.\n\n1. Crea un **Nuevo archivo** y nómbralo de acuerdo con el contenido de tu segunda página. En este caso: **HowToMakeYourGuide_Eng.qmd**\n\n2. Luego necesitarás vincularlo en tu archivo **.yml**.\n\n```{.python}\nproject:\n  type: website\n  output-dir: docs\n\nwebsite:\n  title: \"Cómo Hacer Tu Guía\"\n  navbar:\n    left:\n      - href: HowToMakeYourGuide_Span.qmd\n        text: Span\n      - href: HowToMakeYourGuide_Eng.qmd\n        text: Eng\n\nformat:\n  html:\n    theme: cosmo\n    toc: true\n```\n\n3. ```CTRL+SHIFT+K```. Ahora puedes ver tus dos páginas en la parte superior.\n\n![](media/Picture20a.png)\n\n# Construye tu página web\n\n## Sección de encabezado\n\nAhora podemos construir nuestra página web.\n\n1. En el archivo .qmd, primero especificaremos el título y el autor.\n\n```{.python}\n---\ntitle: \"Cómo Hacer Tu Guía\"\nauthor:\n  - name: Marion Iseppi, Consultora Senior \n---\n```\n\n::: {.callout-note}\nLa sección de encabezado en el archivo .qmd está separada por **---**. Asegúrate de que estén presentes y que se respeten las sangrías.\n:::\n\n2. `CTRL+SHIFT+K` debería actualizar tu vista previa\n\n![](media/Picture6a.png)\n\n3. Puedes agregar tantos detalles como necesites: subtítulo, fecha, especificar más sobre el autor como grado, afiliación, etc.\n\n```{.python}\n---\ntitle: \"Cómo Hacer Tu Guía\"\nsubtitle: \"Saber Cómo Generar Informes Interactivos\"\ndate: 6 June 2024\nauthor:\n  - name: Marion Iseppi, Consultora Senior \n    degree: PhD\n    orcid: 0000-0002-7018-9270\n    email: miseppi@srk.cl\n    corresponding: true\n    affiliation: \n      - name: SRK Consulting Chile SpA \n        url: https://www.srk.com/es/contactenos/chile\n---\n```\n\n## Estilo\n\n4. Luego, especifiquemos el formato. Quarto tiene un formato estandarizado que se puede personalizar con un archivo .css. Un formato SRK está disponible [aquí](styles/srk.css).\n\n5. Crea una carpeta **Styles** en tu carpeta del repositorio y guarda el archivo **srk.css**.\n\n6. Puedes actualizar tu sección de encabezado usando las siguientes palabras clave.\n\n```{.python}\n---\ntitle: \"Cómo Hacer Tu Guía\"\nsubtitle: \"Saber Cómo Generar Informes Interactivos\"\ndate: 6 June 2024\nauthor:\n  - name: Marion Iseppi, Consultora Senior \n    degree: PhD\n    orcid: 0000-0002-7018-9270\n    email: miseppi@srk.cl\n    corresponding: true\n    affiliation: \n      - name: SRK Consulting Chile SpA \n        url: https://www.srk.com/es/contactenos/chile\nformat:\n  html:\n    css: styles/srk.css\n    echo: false\n    embed-resources: false\njupyter: python3\ntoc: true\ntoc-title: \"Tabla de contenido\"\nnumber-sections: true\ntitle-block-banner: true\n---\n```\n\n7. ``CTRL+SHIFT+K``\n\n![](media/Picture7a.png)\n\n::: {.callout-tip}\nEn lugar de vincular tu archivo .css a cada página, también puedes vincularlo a tu archivo **.yml** de la siguiente manera:\n\n```{.python}\nproject:\n  type: website\n\nwebsite:\n  title: \"Cómo Hacer Tu Guía\"\n  navbar:\n    left:\n      - href: HowToMakeYourGuide_Span.qmd\n        text: Span\n\nformat:\n  html:\n    theme: cosmo\n    toc: true\n    css: styles/srk.css\n```\n\n:::\n\n## Autoría\n\n### Encabezados y listas\n\nSeis niveles de encabezados están disponibles en Quarto.\n\n```{.python}\n# Heading 1\n## Heading 2\n### Heading 3\n#### Heading 4\n##### Heading 5\n###### Heading 6\n```\nSe renderiza de la siguiente manera:\n\n![](media/Picture10.png)\n\n1. En tu archivo .qmd, debajo de tu sección de encabezado, ingresa el nombre de tu sección. Por ejemplo:\n\n```{.python}\n# Introducción\n\nLos informes HTML son cada vez más populares ya que permiten una apariencia profesional rápida, incluir gráficos y mapas interactivos. \n```\n\n2. CTRL+SHIFT+K. \n\n![](media/Picture8a.png)\n\n::: {.callout-tip}\nEn la sección de encabezado:\n\n- **number-sections: true** numera automáticamente todos los encabezados. Si deseas eliminarlos, cámbialo a **false**.\n\n- **toc: true** se refiere a la tabla de contenido. Si deseas eliminarla, cámbialo a **false**.\n:::\n\n3. Para listas, tienes varias opciones:\n\n\n```{.python}\n- lista desordenada\n  - subelemento 1\n  - subelemento 2\n- elemento 2\n\n1. lista ordenada\n2. elemento 2\n```\n\nSe renderiza como:\n\n![](media/Picture14a.png)\n\n### Formato de texto\n\nPuedes formatear tu texto fácilmente usando lo siguiente:\n\n```{.python}\n*italics*\n\n**bold**\n\n***bold italics***\n\nsuperscript ^2^ / subscript ~2~\n\n~~strikethrough~~\n\n`verbatim code`\n```\n\nEstos se mostrarán de la siguiente manera:\n\n![](media/Picture18.png)\n\n### Notas\n\nPuedes agregar notas a lo largo de tu sitio para una mejor comprensión usando **callout**.\n\n1. Escribe callout en tu archivo. Con la extensión de Quarto, te propondrá una lista de posibilidades. Intenta y selecciona **callout-note**.\n\n![](media/clip1.mp4){loop=true muted=true autoplay=true}\n\n2. Escribe tu nota dentro de los **:::**\n\n```{.python}\n::: {.callout-note}\nDocumentación extensa está disponible [en línea](https://quarto.org/docs/guide/). \n:::\n```\n\n3. Presiona ```CTRL+SHIFT+K```.\n\n![](media/Picture19a.png)\n\n### Enlaces e imágenes\n\nLa misma sintaxis se puede usar para hipervínculos, enlaces, imágenes o incluso clips de video cortos.\n\n::: {.callout-important}\nLuego usaremos GitHub Pages para publicar nuestro sitio web. \nGitHub no permite archivos que excedan los 100Mb. Asegúrate de que todos los archivos relacionados con tu sitio web, incluidos los archivos descargables, estén por debajo de la limitación.\n:::\n\n1. Para hipervínculos, usa la siguiente sintaxis. Se puede usar dentro del texto y actuará como un hipervínculo al sitio web en cuestión.\n\n```{.python}\nDashboard Power BI se usa comúnmente dentro de SRK ([Conceptos básicos del Dashboard](https://learn.microsoft.com/en-us/power-bi/create-reports/service-dashboards)), es muy útil especialmente para monitorear proyectos.\n```\nSe mostrará como:\n\n![](media/Picture11a.png)\n\n2. Crea una carpeta en tu repositorio llamada **media**. Aquí es donde guardarás todas las imágenes que deseas mostrar en tu sitio web.\n\n3. Para imágenes locales, usa la misma sintaxis. También puedes optar por dejar el pie de foto vacío. También puedes especificar las dimensiones de la imagen usando **{}**.\n\n```{.python}\n![](media/Picture1.png)\n```\nEn este caso, se mostrará como:\n\n![](media/Picture12a.png)\n\n4. Usa la misma sintaxis para mostrar un video. También puedes agregar especificaciones como silenciado, bucle, dimensiones con **{}**.\n\n```{.python}\n![](media/clip1.mp4){loop=true muted=true autoplay=true}\n``` \n\n### Tablas\n\nLa sintaxis para las tablas es la siguiente:\n\n```{.python}\n|Column 1|Column 2|\n|-|-|\n|R1C1|R1C2|\n|R2C1|R2C2|\n```\n\nSe mostrará como:\n\n![](media/Picture16.png)\n\nTambién puedes especificar las dimensiones de tu tabla agregando:\n\n```{.python}\n|Column 1|Column 2|\n|-|-|\n|R1C1|R1C2|\n|R2C1|R2C2|\n: {tbl-colwidths=\"[25,60]\"}\n```\n\nSe muestra como:\n\n![](media/Picture17.png)\n\n::: {.callout-tip}\nComo la construcción de una tabla en Quarto puede llevar mucho tiempo, si ya tienes una tabla en **Word** o **Excel** puedes copiarla y pegarla en [srkCHAT](https://chat.srk.global/) y pedirle que la transforme en formato markdown.\n\n![](media/Picture9.png)\n:::\n\n### Incluir celdas de Python\n\nEn tus informes, es posible que desees mostrar características interactivas. Puedes incluirlas directamente en tu archivo **.qmd**. Ingresa tu script de la siguiente manera y especifica el lenguaje, en este caso, Python.\n\n![](media/Picture21a.png)\n\nSe renderizará de la siguiente manera:\n\n```{python}\nimport plotly.graph_objects as go\nimport numpy as np\n\n# Generar datos de muestra\nnp.random.seed(42)\ndata = np.random.randn(500)\n\n# Crear un histograma\nfig = go.Figure()\n\n# Agregar traza para el histograma\nfig.add_trace(go.Histogram(\n    x=data,\n    name='Datos de Muestra',\n    marker=dict(color='hotpink', line=dict(width=0.5))\n))\n\n# Personalizar diseño\nfig.update_layout(\n    title='Histograma usando Plotly',\n    xaxis_title='Valor',\n    yaxis_title='Frecuencia',\n    template='plotly_white'\n)\n\n# Mostrar el gráfico\nfig.show()\n\n```\n\n### Mostrar bloque de código delimitado\n\nEs posible que desees incluir bloques de celdas sin ejecutarlos. En este caso, agrega un **.** antes de **python**.\n\n![](media/Picture22a.png)\n\nY se renderizará de la siguiente manera:\n\n```{.python}\nimport plotly.graph_objects as go\nimport numpy as np\n\n# Generar datos de muestra\nnp.random.seed(42)\ndata = np.random.randn(500)\n\n# Crear un histograma\nfig = go.Figure()\n\n# Agregar traza para el histograma\nfig.add_trace(go.Histogram(\n    x=data,\n    name='Datos de Muestra',\n    marker=dict(color='hotpink', line=dict(width=0.5))\n))\n\n# Personalizar diseño\nfig.update_layout(\n    title='Histograma usando Plotly',\n    xaxis_title='Valor',\n    yaxis_title='Frecuencia',\n    template='plotly_white'\n)\n\n# Mostrar el gráfico\nfig.show()\n```\n\n# Agrega tu repositorio a GitHub\n\n1. Abre **GitHub Desktop** y ve a Archivo > Nuevo Repositorio. Ingresa la ruta local a tu repositorio:\n\n![](media/Picture23.png)\n\n2. Desmarca **Keep this code private** y haz clic en **Publish repository** en la ventana principal de GitHub Desktop.\n\n![](media/Picture24.png)\n\n::: {.callout-note}\nPara usar GitHub Pages para publicar tu sitio web, tu código tendrá que ser público. Si deseas restringir el acceso a tu sitio web, puedes usar una versión paga de **GitHub Enterprise**.\n:::\n\n3. Si vas a la pestaña **History**, puedes cambiar lo que se ha publicado. Deberías ver todo tu repositorio.\n\n![](media/Picture25.png)\n\n4. Ahora ve a tu cuenta en [GitHub](https://github.com/), haz clic en tu imagen de perfil de usuario, repositorio:\n\n![](media/Picture26.png)\n\n# Publicar en GitHub\n\n## Prepara tu proyecto para GitHub\n\nAhora que has creado tus páginas y que tu repositorio ha sido publicado en GitHub, desplegaremos tu sitio web usando **GitHub Pages**.\n\n1. En tu terminal ingresa:\n\n```{.python}\nquarto render\n```\nPuedes ver que ha creado una carpeta **docs** en la raíz de tu repositorio.\n\n![](media/Picture27.png)\n\n::: {.callout-note}\nSi aún estás visualizando la vista previa de tu sitio web usando ``CTRL+SHIFT+K``, notarás que tu terminal está ocupada. \nPara detener el comando, haz clic en tu terminal y usa ``CTRL+C``.\n:::\n\n2. Ve a la pestaña ``CONTROL DE FUENTES`` en la barra lateral izquierda de VS Code. Verás que hay varios cambios almacenados. Los vas a confirmar en GitHub.\n\n![](media/Picture28.png)\n\n3. Haz clic en el signo **+** **Stage All Changes** y **COMMIT**. Se abrirá una ventana **COMMIT_EDITMSG**. En la primera línea, ingresa una breve descripción de los cambios. Luego guarda y cierra la ventana.\n\n![](media/Picture29.png)\n\n4. Luego haz clic en **Sync Changes**. Una ventana te advertirá que VS Code va a enviar los cambios a GitHub, haz clic en **OK**.\n\n![](media/Picture30.png)\n\n## GitHub Pages\n\n1. Ve a tu repositorio en línea y haz clic en el recién publicado. Luego en la barra superior ve a **Settings**.\n\n![](media/Picture31.png)\n\n2. En **Settings**, haz clic en **Pages** que se encuentra en la barra de navegación izquierda.\n\n![](media/Picture32.png)\n\n3. En Pages, especifica la rama a **main** y la carpeta a **/docs**. Luego haz clic en ``Save``. Deberías ver aparecer una banda azul *GitHub Pages saved*.\n\n![](media/Picture33.png)\n\n4. Actualiza tu página, ahora deberías ver un enlace a tu sitio web construido como sigue: **https://tu-usuario.github.io/tu-nombre-del-repositorio**. Ve a tu sitio web.\n\n![](media/Picture34.png)\n\n<center><div style=\"font-size: 150%; color:darkorange\"><b>¡Está hecho!</b></div></center>\n\n![](media/Picture35.png)\n\n"},"formats":{"html":{"execute":{"fig-width":7,"fig-height":5,"fig-format":"retina","fig-dpi":96,"df-print":"default","error":false,"eval":true,"cache":null,"freeze":false,"echo":false,"output":true,"warning":true,"include":true,"keep-md":false,"keep-ipynb":false,"ipynb":null,"enabled":null,"daemon":null,"daemon-restart":false,"debug":false,"ipynb-filters":[],"engine":"jupyter"},"render":{"keep-tex":false,"keep-source":false,"keep-hidden":false,"prefer-html":false,"output-divs":true,"output-ext":"html","fig-align":"default","fig-pos":null,"fig-env":null,"code-fold":"none","code-overflow":"scroll","code-link":false,"code-line-numbers":false,"code-tools":false,"tbl-colwidths":"auto","merge-includes":true,"latex-auto-mk":true,"latex-auto-install":true,"latex-clean":true,"latex-max-runs":10,"latex-makeindex":"makeindex","latex-makeindex-opts":[],"latex-tlmgr-opts":[],"latex-input-paths":[],"latex-output-dir":null,"link-external-icon":false,"link-external-newwindow":false,"self-contained-math":false,"format-resources":[]},"pandoc":{"standalone":true,"wrap":"none","default-image-extension":"png","to":"html","toc":true,"css":["styles/srk.css"],"number-sections":true,"embed-resources":false,"output-file":"HowToMakeYourGuide_Span.html"},"language":{},"metadata":{"lang":"en","fig-responsive":true,"quarto-version":"1.2.313","theme":"cosmo","title":"Cómo Hacer Tu Guía","subtitle":"Saber Cómo Generar Informes Interactivos","date":"6 June 2024","author":[{"name":"Marion Iseppi, Consultora Senior","degree":"PhD","orcid":"0000-0002-7018-9270","email":"miseppi@srk.cl","corresponding":true,"affiliation":[{"name":"SRK Consulting Chile SpA","url":"https://www.srk.com/es/contactenos/chile"}]}],"jupyter":"python3","toc-title":"Tabla de contenido","title-block-banner":true},"extensions":{"book":{"multiFile":true}}}}}